headline,summary,source,url,published_at
"Walmart’s stock is on pace for a new high, thanks to shopping partnership with OpenAI","Walmart Inc. was among the top performers on the Dow Jones Industrial Average on Tuesday and on pace to reach a new record high, after the big-box chain announced a partnership that will soon allow customers to buy items at the retailer through ChatGPT.",MarketWatch,https://www.marketwatch.com/story/walmarts-stock-is-on-pace-for-a-new-high-thanks-to-shopping-partnership-with-openai-6aabd465,2025-10-14 19:15:00
'The job is stressful enough.' Air traffic controllers get partial paychecks as government shutdown heads for third week,Air traffic controllers are required to work despite no pay during the government shutdown.,CNBC,https://www.cnbc.com/2025/10/14/government-shutdown-air-traffic-controllers.html,2025-10-14 19:10:50
The stock market performs much better when the government is actually doing its job,Politically polarized ‘gridlock’ in Washington leads to a significant reduction in both U.S. corporate investment and share prices.,MarketWatch,https://www.marketwatch.com/story/the-stock-market-performs-much-better-when-the-government-is-actually-doing-its-job-d071f9d1,2025-10-14 19:03:00
"‘It’s getting scary close to retirement’: We’re 70. We have no debt, no stocks and $275K in savings. Are we in trouble?","“We will have $4,300 a month in Social Security.”",MarketWatch,https://www.marketwatch.com/story/its-getting-scary-close-to-retirement-were-70-we-have-no-debt-no-stocks-and-275k-in-savings-are-we-in-trouble-1a4ba5f6,2025-10-14 19:00:00
"Religion, bookstores and running clubs are in: Gen Z’s ‘great unplugging’ is charging up these 6 stocks.",Younger Americans are walking away from screens and rediscovering the physical world.,MarketWatch,https://www.marketwatch.com/story/religion-bookstores-and-running-clubs-are-in-gen-zs-great-unplugging-is-charging-up-these-6-stocks-842f3055,2025-10-14 18:37:00
AI isn’t the solution to financial fraud — it actually might be the biggest problem,AI-generated scams are becoming more widespread.,MarketWatch,https://www.marketwatch.com/story/ai-isnt-the-solution-to-financial-fraud-it-actually-might-be-the-biggest-problem-4605aa66,2025-10-14 18:25:00
Gold will not protect you from inflation,Gold’s reputation as a hedge against inflation is constantly repeated until everyone just assumes it’s true.,MarketWatch,https://www.marketwatch.com/story/gold-will-not-protect-you-from-inflation-feafefa8,2025-10-14 18:15:00
"Boeing delivers 55 planes in September, on track for most in a year since 2018","Boeing handed over 55 aircraft in September, putting it on track for most annual deliveries since 2018 as production stabilizes.",CNBC,https://www.cnbc.com/2025/10/14/boeing-orders-deliveries-737-max.html,2025-10-14 18:00:01
"The AI boom is lifting the stock market, but it may be masking a weaker economy",AI spending is powering growth in GDP and profits but experts warn the rest of the U.S. economy may be weakening.,CNBC,https://www.cnbc.com/2025/10/14/ai-infrastructure-boom-masks-potential-us-recession-analyst-warns.html,2025-10-14 17:47:47
AMD is keeping its momentum alive. Here are two reasons for optimism.,"AMD just announced an extension of its relationship with Oracle. Plus, an analyst upgraded the stock and implied Wall Street’s profit expectations aren’t high enough.",MarketWatch,https://www.marketwatch.com/story/amd-is-keeping-its-momentum-alive-here-are-two-reasons-for-optimism-f12ce20c,2025-10-14 17:35:00
"Stocks keep soaring, but economists don’t think it creates a risk of financial crisis",Why the current AI boom shouldn’t be compared with the environments seen in the late 1990s and late 2000s.,MarketWatch,https://www.marketwatch.com/story/stocks-keep-soaring-but-economists-dont-think-it-creates-a-risk-of-financial-crisis-14489ef3,2025-10-14 17:17:00
"They love self-care, hate hustle, and need a job—a CEO's advice for an 'unemployable' Gen Zer","There's a sharp divide between what Gen Z values and what hiring managers are actually looking for, according to new research. CEO and Harvard-trained career expert Suzy Welch shares her advice for an ""unemployable"" generation.",CNBC,https://www.cnbc.com/2025/10/14/they-hate-hustle-but-need-a-joba-ceos-advice-for-an-unemployable-gen-z.html,2025-10-14 16:47:17
Can I put my RMD into my Roth IRA?,It’s Required Minimum Distribution season. What you can — and can’t do with them.,MarketWatch,https://www.marketwatch.com/story/can-i-put-my-rmd-into-my-roth-ira-244a0c46,2025-10-14 16:45:00
Jim Cramer's top 10 things to watch in the stock market Tuesday,Stock futures fell Tuesday as trade tensions between the U.S. and China intensified.,CNBC,https://www.cnbc.com/2025/10/14/jim-cramers-top-10-things-to-watch-in-the-stock-market-tuesday.html,2025-10-14 16:18:25
"U.S. economy still vulnerable to tariff shocks, IMF says, and labor shortages tied to immigration crackdown could also sting",The U.S. economy hasn’t suffered much so far from big increases in tariffs or a decline in the labor supply due to tighter immigration rules. But that might change.,MarketWatch,https://www.marketwatch.com/story/u-s-economy-still-vulnerable-to-tariff-shocks-imf-says-and-labor-shortages-tied-to-immigration-crackdown-could-also-sting-8987be99,2025-10-14 16:10:00
GM will take a $1.6 billion hit as it predicts a drop in EV demand. Here’s the latest setback.,GM’s stock is falling as the end of a critical tax credit will force the company to scale back its plans for EV investments.,MarketWatch,https://www.marketwatch.com/story/gm-will-take-a-1-6-billion-hit-as-it-predicts-a-drop-in-ev-demand-heres-the-latest-setback-2a3b792d,2025-10-14 15:26:00
Why your stock and bond index funds outsmart managers of college endowments,The best and the brightest are neither when it comes to investing.,MarketWatch,https://www.marketwatch.com/story/why-your-stock-and-bond-index-funds-outsmart-managers-of-college-endowments-db81876e,2025-10-14 15:02:00
Rockefeller Capital secures backing from Chanel dynasty's family office and others,The wealth advisory born from one of the world's oldest family offices is now worth $6.6 billion.,CNBC,https://www.cnbc.com/2025/10/14/rockefeller-capital-mousse-partners-greg-fleming-expansion.html,2025-10-14 15:00:02
Johnson & Johnson’s stock heads for a record after a profit beat and plans for another spinoff,Johnson & Johnson’s stock rose toward a record after a beat-and-raise earnings report and announcement of plans to separate its orthopedics business.,MarketWatch,https://www.marketwatch.com/story/johnson-johnsons-stock-heads-for-a-record-after-a-profit-beat-and-plans-for-another-spinoff-af403f00,2025-10-14 14:44:00
Ericsson’s stock rallies as bears surprised by earnings beat and positive guidance,Ericsson’s CEO hinted that there may be higher dividends or share buybacks coming.,MarketWatch,https://www.marketwatch.com/story/ericssons-stock-rallies-as-bears-surprised-by-earnings-beat-and-positive-guidance-a6f6732b,2025-10-14 14:38:00
ArcelorMittal M&A Head holds talks in South Africa over unit sale,The executive’s presence in the country is a sign that the discussions between the Luxembourg-based steelmaker and the Industrial Development Corp. have accelerated,Bloomberg,https://www.bloomberg.com/news/articles/2025-10-14/arcelormittal-m-a-head-holds-talks-in-south-africa-over-unit-sale,2025-10-14 14:07:53
Friday’s selloff broke something in the stock market. Here’s what that means for investors.,Longview Economics says investors should tread carefully with stocks as something was broken with Friday’s selloff last week.,MarketWatch,https://www.marketwatch.com/story/fridays-selloff-broke-something-in-the-stock-market-heres-what-that-means-for-investors-f93ae0c3,2025-10-14 13:57:00
My stepdaughter is buying a house. Can her soon-to-be ex-husband claim a share?,“Her real-estate agent has assured her that she has nothing to worry about.”,MarketWatch,https://www.marketwatch.com/story/my-stepdaughter-is-buying-a-house-can-her-soon-to-be-ex-husband-claim-a-share-320a8394,2025-10-14 12:30:00
Maroon 5’s Adam Levine and supermodel Behati Prinsloo get a $60 million offer on their Montecito mansion,"The couple are set to make another incredibly lucrative real estate deal after finding a buyer for their extraordinary Montecito, Calif., estate.",MarketWatch,https://www.marketwatch.com/story/maroon-5s-adam-levine-and-supermodel-behati-prinsloo-get-a-60-million-offer-on-their-montecito-mansion-439891f9,2025-10-14 12:04:00
Former Falcons star Grady Jarrett lists his $6.3 million luxury bachelor pad in Atlanta,Grady Jarrett is going all in on Illinois by putting his sprawling Georgia mansion on the market just months after signing a $43.5 million contract with the Chicago Bears.,MarketWatch,https://www.marketwatch.com/story/former-falcons-star-grady-jarrett-lists-his-6-3-million-luxury-bachelor-pad-in-atlanta-134de014,2025-10-14 12:02:00
A new front opens in the Sino-American trade war – this time at sea.,China imposes sanctions on five subsidiaries of South Korea’s Hanwha Ocean.,MarketWatch,https://www.marketwatch.com/story/a-new-front-opens-in-the-sino-american-trade-war-this-time-at-sea-6498fd98,2025-10-14 11:43:00
UK witness 50% spike in cyberattacks as top firms targeted,"UK faces increasing cyberattacks from criminals and hostile states, impacting major companies and national security, warns cyber security agency.",Bloomberg,https://www.bloomberg.com/news/articles/2025-10-13/uk-sees-50-spike-in-major-cyberattacks-as-top-firms-targeted,2025-10-14 08:11:25
Europe fights for AI independence to avoid becoming tech ‘Colony’,"Europe’s push mirrors efforts around the world, from Canada to South Korea to the Middle East, where governments are frantically marshalling resources to avoid ceding too much of the AI market to the US and China",Bloomberg,https://www.bloomberg.com/news/articles/2025-10-14/europe-aims-for-ai-independence-to-avoid-reliance-on-us-and-china,2025-10-14 07:43:54
"Too many speculative names fueled Monday's rally, Jim Cramer says",CNBC's Jim Cramer explained why Monday's rebound gives him pause.,CNBC,https://www.cnbc.com/2025/10/13/too-many-speculative-names-fueled-mondays-rally-jim-cramer-says.html,2025-10-14 01:59:29
Where Penn State football coach James Franklin’s $49 million buyout ranks among the biggest of all time,Buyouts are becoming a big trend among college football coaches. Why schools are so willing to pay up.,MarketWatch,https://www.marketwatch.com/story/where-penn-state-football-coach-james-franklins-49-million-buyout-ranks-among-the-biggest-of-all-time-7ee9f16e,2025-10-14 01:27:00
Musk calls for federal troops in San Francisco even as Benioff softens stance,"With Dreamforce about to kick off in San Francisco, Salesforce CEO Marc Benioff inserted himself into a national debate about crime in U.S. cities.",CNBC,https://www.cnbc.com/2025/10/13/musk-calls-for-federal-troops-in-san-francisco-benioff-softens-stance.html,2025-10-14 01:22:51
