ticker,publishedAt,title,description,content,source
ASELS.IS,2026-04-01 02:46:58,How many people have been killed in the Iran war?,"A devastating war has erupted in the Middle East following strikes on Iran. Thousands have lost their lives across the region. Iran retaliated with attacks on Israel and US bases. New fronts have opened in Lebanon. Reports detail casualties in Iran, Lebanon, …","Thousands of people have been killed across the Middle East in the Iran war, which began when the U.S. and Israel struck Iran on February 28. Those strikes triggered Iranian attacks on Israel, U.S. b… [+4851 chars]",NewsAPI
THYAO.IS,2026-04-01 00:00:00,Why customers are choosing Red Hat AI for real business outcomes,"Most leaders I speak with are well past the hype cycle of AI. The question is no longer whether AI matters. The question is how to move from experimentation to production in a way that is security-focused, supportable, and repeatable across teams.From where I…",Most leaders I speak with are well past the hype cycle of AI. The question is no longer whether AI matters. The question is how to move from experimentation to production in a way that is security-fo… [+6084 chars],NewsAPI
THYAO.IS,2026-03-31 15:32:31,ITA Airways Joins Star Alliance,"Star Alliance welcomes Italy’s flag carrier, further enabling seamless journeysfor customers worldwide. ROME, March 31, 2026 (GLOBE NEWSWIRE) — Star Alliance officially welcomed ITA Airways as its newest member, marking the completion of the Italian carrier’s…","ITA Airways, which flies over 16 million customers every year, adds more than 350 daily flights to the Alliance network, supported by a strong domestic and regional footprint. The addition expands tr… [+3391 chars]",NewsAPI
THYAO.IS,2026-03-31 15:30:00,ITA Airways Joins Star Alliance,"Star Alliance welcomes Italy’s flag carrier, further enabling seamless journeysfor customers worldwide.  ROME, March  31, 2026  (GLOBE NEWSWIRE) -- Star...","Star Alliance welcomes Italys flag carrier, further enabling seamless journeysfor customers worldwide.
ROME, March 31, 2026 (GLOBE NEWSWIRE) -- Star Alliance officially welcomed ITA Airways as its n… [+8832 chars]",NewsAPI
THYAO.IS,2026-03-31 14:59:02,"Mongolia’s Next Chapter in Travel Is Unfolding, From Ulaanbaatar to the Steppe","With a new wave of luxury wellness amenities well underway, travel to Mongolia is on the rise.","Mongolia’s tourism sector is growing. Sodbayar Photography/Unsplash
When I arrived in Mongolia in 2009, there was exactly one baggage carousel at the international airport. During my entire 10-day s… [+7612 chars]",NewsAPI
ASELS.IS,2026-03-31 06:37:53,Aselsan launches 2nd LUNA satellite for space-based IoT services,"Turkish defense giant Aselsan said it has successfully launched its second satellite, LUNA-2, from California aboard a SpaceX rocket as part of its space-based Internet of Things (IoT) solutions program.","ISTANBUL
Turkish defense giant Aselsan said it has successfully launched its second satellite, LUNA-2, from California aboard a SpaceX rocket as part of its space-based Internet of Things (IoT) solu… [+1247 chars]",NewsAPI
AKBNK.IS,2026-03-30 19:00:32,"XRP Expert Says The Moment Has Finally Come, Here’s What He Means","The XRP conversation has always been based on future potential, regulatory clarity, and institutional adoption that always seemed just out of reach. Now, one crypto commentator believes those pieces are no longer forming in isolation but are now coming togeth…","The XRP conversation has always been based on future potential, regulatory clarity, and institutional adoption that always seemed just out of reach. Now, one crypto commentator believes those pieces … [+3092 chars]",NewsAPI
THYAO.IS,2026-03-30 09:35:24,Heavy rain grounds traffic at Istanbul’s Sabiha Gökçen Airport,"Severe rainfall disrupting parts of Istanbul has significantly affected air traffic at Sabiha Gökçen Airport, where reduced visibility forced dozens of incoming flights to abort landings and remain in holding patterns.","ISTANBUL
Severe rainfall disrupting parts of Istanbul has significantly affected air traffic at Sabiha Gökçen Airport, where reduced visibility forced dozens of incoming flights to abort landings an… [+1463 chars]",NewsAPI
PGSUS.IS,2026-03-30 09:35:24,Heavy rain grounds traffic at Istanbul’s Sabiha Gökçen Airport,"Severe rainfall disrupting parts of Istanbul has significantly affected air traffic at Sabiha Gökçen Airport, where reduced visibility forced dozens of incoming flights to abort landings and remain in holding patterns.","ISTANBUL
Severe rainfall disrupting parts of Istanbul has significantly affected air traffic at Sabiha Gökçen Airport, where reduced visibility forced dozens of incoming flights to abort landings an… [+1463 chars]",NewsAPI
THYAO.IS,2026-03-30 08:31:25,How Iran war is causing massive turbulence for aviation industry,"The sector has weathered storms before, but this one is different: routes are blocked, fuel is scarce and the bills are already arriving","Analysis: Aviation has weathered storms before, but this one is different: routes are blocked, fuel is scarce and the bills are already arriving
The war between the United States, Israel and Iran is… [+5911 chars]",NewsAPI
KCHOL.IS,2026-03-29 05:08:00,"Vikings Rumor Buzz: Baker Mayfield to MIN, Fabian Moreau, Ty Simpson","NFL free agency has ground to a halt, and the Minnesota Vikings were quiet before and after signing quarterback Kyler […]","NFL free agency has ground to a halt, and the Minnesota Vikings were quiet before and after signing quarterback Kyler Murray. Next up is the draft in less than four weeks, so we take a look at the cu… [+5559 chars]",NewsAPI
THYAO.IS,2026-03-29 04:39:00,Crystal Balling,"If that disruption lasts six months, it becomes a cash-flow problem, not just a flight problem. If there is a ceasefire next week, the first impact on travel will be operational, not emotional: flights should start normalising, but passenger behaviour will la…","If that disruption lasts six months, it becomes a cash-flow problem, not just a flight problem. If there is a ceasefire next week, the first impact on travel will be operational, not emotional: fligh… [+23763 chars]",NewsAPI
MGROS.IS,2026-03-28 16:51:28,rbcli added to PyPI,Swiss Open Banking CLI via SIX bLink API and OpenWealth API — optimized for LLM agents,"Swiss Open Banking from your terminal. Payments, accounts, statements, product comparison, infrastructure monitoring, cryptographic signing, an independent git-backed ledger, and LLM safety guardrail… [+18014 chars]",NewsAPI
MGROS.IS,2026-03-28 13:29:08,“Today I Learned”: 67 Interesting Facts People Suddenly Stumble Upon,You're never too old to learn something new and the Today I Learned subreddit proves it everyday with new random fascinating facts.,"You’re never too old to learn something new. I love discovering fascinating facts whenever I can, and one of my favorite places to find them is the Today I Learned subreddit, a community dedicated to… [+16652 chars]",NewsAPI
TUPRS.IS,2026-03-27 17:00:00,Inter Milan Midfielder ‘Proud’ Of National Team Impact Ahead Of Crucial World Cup Play-Off Final,"Hakan Calhanoglu delivered an emotional and proud reaction after Turkey beat Romania 1-0 to reach the World Cup play-off final, with the Inter Milan midfielder reflecting on a landmark evening for bot...","Hakan Calhanoglu delivered an emotional and proud reaction after Turkey beat Romania 1-0 to reach the World Cup play-off final, with the Inter Milan midfielder reflecting on a landmark evening for bo… [+1709 chars]",NewsAPI
ASELS.IS,2026-03-27 02:53:07,Iran-Israel war: How many people have been killed in the West Asia conflict?,"A major conflict has erupted in the Middle East. The Iran war began after US and Israeli forces struck Iran. This led to retaliatory attacks on Israel, US bases, and Gulf states. A new front has opened in Lebanon. Thousands have lost their lives across the re…","Thousands of people have been killed across the Middle East in the Iran war, which began when the U.S. and Israel struck Iran on February 28, triggering Iranian attacks on Israel, U.S. bases and Gulf… [+4041 chars]",NewsAPI
MGROS.IS,2026-03-26 19:20:00,"Opentech Powers New Money Transfer Solution PayInit AG for Viseca, Cornèr Bank","Viseca Payment Services and Cornèr Bank have teamed up to develop a new open industry solution for international peer-to-peer money transfers leveraging Mastercard and Visa payment cards. The new offering, PayInit AG, will streamline direct, cross-border tran…","<ul>
<li>Italian fintech Opentech will power a new peer-to-peer money transfer solution under development by Viseca Payment Services and Cornèr Bank.</li>



<li>Viseca and Cornèr Bank will leverage … [+4543 chars]",NewsAPI
THYAO.IS,2026-03-26 15:00:16,4 ways to book Icelandair flights with points and miles,"Icelandair isn’t in any of the major airline alliances, but you still have award options. Here are four ways to book Icelandair flights with points and miles.","Icelandair is a popular carrier for visiting Iceland because its hub, Keflavik Airport (KEF), is about 31 miles from Reykjavik. Icelandair is well known for its low fares, and many travelers use the … [+6149 chars]",NewsAPI
TUPRS.IS,2026-03-26 05:30:00,World Cup play-offs – A guide to the teams vying for four coveted spots,"Over the next few days, 16 teams will battle for four coveted spots in the 2026 World Cup in the US, Canada and Mexico.","Over the next few days, 16 teams will battle for four coveted spots in the 2026 World Cup in the US, Canada and Mexico.The European play-offs feature the 12 runners-up from each group, including Irel… [+7633 chars]",NewsAPI
AKBNK.IS,2026-03-26 01:00:38,Why SWIFT’s Latest Global Payments Infrastructure Is Bullish For XRP Holders,"Crypto pundit Archie has explained why SWIFT’s new global payments infrastructure is bullish for XRP holders. This came as the pundit highlighted how SWIFT’s major partners use Ripple’s RippleNet, which involves the altcoin.  Why SWIFT’s Payments Framework Is…","Crypto pundit Archie has explained why SWIFTs new global payments infrastructure is bullish for XRP holders. This came as the pundit highlighted how SWIFTs major partners use Ripples RippleNet, which… [+2775 chars]",NewsAPI
HALKB.IS,2026-02-13 11:10:00,"Halkbank Üreten Kadınlar Yarışması Ödül Töreni, Halkbank Genel Müdürlüğü'nde düzenlendi","Kadınların üretim ve ekonomideki rolünü güçlendirmek, girişimcilik yolunda ortaya koydukları ilham verici başarıları daha görünür kılmak ve onları cesaretlendirmek amacıyla bu yıl beşincisi gerçekleştirilen Halkbank Üreten Kadınlar Yarışması Ödül Töreni, İstanbul Finans Merkezi Halkbank Genel Müdürlüğü'nde düzenlendi.","Halkbank Üreten Kadınlar Yarışması Ödül Töreni, Halkbank Genel Müdürlüğü'nde düzenlendi Kadınların üretim ve ekonomideki rolünü güçlendirmek, girişimcilik yolunda ortaya koydukları ilham verici başarıları daha görünür kılmak ve onları cesaretlendirmek amacıyla bu yıl beşincisi gerçekleştirilen Halkbank Üreten Kadınlar Yarışması Ödül Töreni, İstanbul Finans Merkezi Halkbank Genel Müdürlüğü'nde düzenlendi.",Hürriyet Ekonomi
ASELS.IS,2024-10-03 08:38:40,Türk mühendisler Aselsan'a geri dönüyor,"ASELSAN Genel Müdürü Ahmet Akyol ""Geçen bir yıl içinde Türkiye'ye geri dönüp ASELSAN'da mühendis olacağım diyen 245 arkadaş başvurmuştu. Şu an 9 aylık rakam 700 kişiye ulaştı"" dedi.","Türk mühendisler Aselsan'a geri dönüyor ASELSAN Genel Müdürü Ahmet Akyol ""Geçen bir yıl içinde Türkiye'ye geri dönüp ASELSAN'da mühendis olacağım diyen 245 arkadaş başvurmuştu. Şu an 9 aylık rakam 700 kişiye ulaştı"" dedi.",Hürriyet Ekonomi
THYAO.IS,2024-10-03 08:04:55,THY'den personel alımı ilanı,Türk Hava Yolları tecrübeli ve tecrübesiz personel alımı için ilana çıktı. Başvuru için son tarih 14 Ekim 2024 oldu.,THY'den personel alımı ilanı Türk Hava Yolları tecrübeli ve tecrübesiz personel alımı için ilana çıktı. Başvuru için son tarih 14 Ekim 2024 oldu.,Hürriyet Ekonomi
